{
  "$schema": "http://json-schema.org/draft-07/schema#",
  "type": "array",
  "items": {
    "type": "object",
    "properties": {
      "roundNumber": {
        "type": "integer",
        "minimum": 1,
        "maximum": 9007199254740991
      },
      "tick": {
        "type": "integer",
        "minimum": 1,
        "maximum": 9007199254740991
      },
      "flashId": {
        "type": [
          "string",
          "null"
        ]
      },
      "flasherIndex": {
        "type": "integer",
        "minimum": 0,
        "maximum": 9007199254740991
      },
      "flashedIndex": {
        "type": "integer",
        "minimum": 0,
        "maximum": 9007199254740991
      },
      "durationSeconds": {
        "type": "number",
        "minimum": 0,
        "maximum": 6
      }
    },
    "required": [
      "roundNumber",
      "tick",
      "flashId",
      "flasherIndex",
      "flashedIndex",
      "durationSeconds"
    ],
    "additionalProperties": false
  }
}
